{
  "sample_id": "exp_1000",
  "session_id": "exp_1000-66a21619",
  "sanitized_text": "Employee <PERSON_1> recorded a rideshare expense of <AMOUNT_1> on <DATE_1> with <VENDOR_1>. Employee ID <EMPLOYEE_ID_1>, invoice <INVOICE_ID_1>, card ending <CARD_LAST4_1>, email <EMAIL_1>, phone <PHONE_NUMBER_1>. Receipt attachment missing and the note says the expense might belong to a shared ride.",
  "public_context": {
    "workflow_type": "expense_review",
    "expense_type": "taxi_rideshare",
    "currency": "USD",
    "policy_key": "taxi_cap_usd",
    "receipt_attached": false,
    "requires_sum": false,
    "requires_cap_validation": true,
    "note_is_ambiguous": true
  },
  "metadata": {
    "PERSON_1": {
      "entity_type": "PERSON",
      "placeholder": "<PERSON_1>",
      "allowed_ops": [],
      "allowed_he_ops": [],
      "policy_action": "tokenize_encrypt",
      "source": "gliner_heuristic",
      "score": 0.64
    },
    "AMOUNT_1": {
      "entity_type": "AMOUNT",
      "placeholder": "<AMOUNT_1>",
      "allowed_ops": [
        "compare_policy_cap",
        "sum",
        "subtract"
      ],
      "allowed_he_ops": [
        "fhe_compare_policy_cap",
        "fhe_subtract_policy_cap",
        "fhe_sum_amounts",
        "fhe_min_policy_cap"
      ],
      "policy_action": "tokenize_encrypt",
      "source": "rule",
      "score": 0.99
    },
    "DATE_1": {
      "entity_type": "DATE",
      "placeholder": "<DATE_1>",
      "allowed_ops": [
        "compare_submission_window"
      ],
      "allowed_he_ops": [
        "fhe_compare_date_window"
      ],
      "policy_action": "tokenize_encrypt",
      "source": "rule",
      "score": 0.99
    },
    "VENDOR_1": {
      "entity_type": "VENDOR",
      "placeholder": "<VENDOR_1>",
      "allowed_ops": [],
      "allowed_he_ops": [],
      "policy_action": "tokenize_or_category",
      "source": "gliner_heuristic",
      "score": 0.56
    },
    "EMPLOYEE_ID_1": {
      "entity_type": "EMPLOYEE_ID",
      "placeholder": "<EMPLOYEE_ID_1>",
      "allowed_ops": [],
      "allowed_he_ops": [],
      "policy_action": "tokenize_encrypt",
      "source": "rule",
      "score": 0.99
    },
    "INVOICE_ID_1": {
      "entity_type": "INVOICE_ID",
      "placeholder": "<INVOICE_ID_1>",
      "allowed_ops": [],
      "allowed_he_ops": [],
      "policy_action": "tokenize_encrypt",
      "source": "rule",
      "score": 0.99
    },
    "CARD_LAST4_1": {
      "entity_type": "CARD_LAST4",
      "placeholder": "<CARD_LAST4_1>",
      "allowed_ops": [],
      "allowed_he_ops": [],
      "policy_action": "tokenize_encrypt",
      "source": "rule",
      "score": 0.99
    },
    "EMAIL_1": {
      "entity_type": "EMAIL",
      "placeholder": "<EMAIL_1>",
      "allowed_ops": [],
      "allowed_he_ops": [],
      "policy_action": "tokenize_encrypt",
      "source": "rule",
      "score": 0.99
    },
    "PHONE_NUMBER_1": {
      "entity_type": "PHONE_NUMBER",
      "placeholder": "<PHONE_NUMBER_1>",
      "allowed_ops": [],
      "allowed_he_ops": [],
      "policy_action": "tokenize_encrypt",
      "source": "rule",
      "score": 0.99
    }
  },
  "policy_summary": {
    "meal_cap_usd": {
      "scope": "local_only",
      "description": "Meal expenses require local cap validation.",
      "supported_he_ops": [
        "fhe_compare_policy_cap",
        "fhe_subtract_policy_cap",
        "fhe_min_policy_cap"
      ]
    },
    "hotel_cap_usd": {
      "scope": "local_only",
      "description": "Hotel expenses require local cap validation.",
      "supported_he_ops": [
        "fhe_compare_policy_cap",
        "fhe_subtract_policy_cap"
      ]
    },
    "airfare_cap_usd": {
      "scope": "local_only",
      "description": "Airfare expenses require local cap validation.",
      "supported_he_ops": [
        "fhe_compare_policy_cap",
        "fhe_subtract_policy_cap"
      ]
    },
    "taxi_cap_usd": {
      "scope": "local_only",
      "description": "Taxi and rideshare expenses require local cap validation.",
      "supported_he_ops": [
        "fhe_compare_policy_cap",
        "fhe_subtract_policy_cap"
      ]
    },
    "software_subscription_cap_usd": {
      "scope": "local_only",
      "description": "Software subscriptions require local cap validation.",
      "supported_he_ops": [
        "fhe_compare_policy_cap",
        "fhe_subtract_policy_cap"
      ]
    },
    "submission_window_days": {
      "scope": "local_only",
      "description": "Expense submission timing must be verified locally.",
      "supported_he_ops": [
        "fhe_compare_date_window"
      ]
    }
  }
}
