{
  "sample_id": "exp_0001",
  "session_id": "exp_0001-fdde91d6",
  "sanitized_text": "Employee <PERSON_1> <PERSON_2> submitted a team offsite meal summary: meal <AMOUNT_1>, tip <AMOUNT_2>, tax <AMOUNT_3> on <DATE_1> at vendor <VENDOR_1>. Invoice <INVOICE_ID_1>, project <PROJECT_CODE_1>, cost center <COST_CENTER_1>, employee ID <EMPLOYEE_ID_1>, email <EMAIL_1>, phone <PHONE_NUMBER_1>.",
  "metadata": {
    "PERSON_1": {
      "entity_type": "PERSON",
      "placeholder": "<PERSON_1>",
      "allowed_ops": [],
      "allowed_he_ops": [],
      "policy_action": "tokenize_encrypt",
      "source": "gliner_native",
      "score": 0.9966
    },
    "PERSON_2": {
      "entity_type": "PERSON",
      "placeholder": "<PERSON_2>",
      "allowed_ops": [],
      "allowed_he_ops": [],
      "policy_action": "tokenize_encrypt",
      "source": "gliner_native",
      "score": 0.4614
    },
    "AMOUNT_1": {
      "entity_type": "AMOUNT",
      "placeholder": "<AMOUNT_1>",
      "allowed_ops": [
        "compare_policy_cap",
        "sum",
        "subtract"
      ],
      "allowed_he_ops": [
        "fhe_subtract_policy_cap",
        "fhe_sum_amounts"
      ],
      "policy_action": "tokenize_encrypt",
      "source": "rule",
      "score": 0.99
    },
    "AMOUNT_2": {
      "entity_type": "AMOUNT",
      "placeholder": "<AMOUNT_2>",
      "allowed_ops": [
        "compare_policy_cap",
        "sum",
        "subtract"
      ],
      "allowed_he_ops": [
        "fhe_subtract_policy_cap",
        "fhe_sum_amounts"
      ],
      "policy_action": "tokenize_encrypt",
      "source": "rule",
      "score": 0.99
    },
    "AMOUNT_3": {
      "entity_type": "AMOUNT",
      "placeholder": "<AMOUNT_3>",
      "allowed_ops": [
        "compare_policy_cap",
        "sum",
        "subtract"
      ],
      "allowed_he_ops": [
        "fhe_subtract_policy_cap",
        "fhe_sum_amounts"
      ],
      "policy_action": "tokenize_encrypt",
      "source": "rule",
      "score": 0.99
    },
    "DATE_1": {
      "entity_type": "DATE",
      "placeholder": "<DATE_1>",
      "allowed_ops": [
        "compare_submission_window"
      ],
      "allowed_he_ops": [
        "fhe_compare_date_window"
      ],
      "policy_action": "tokenize_encrypt",
      "source": "rule",
      "score": 0.99
    },
    "VENDOR_1": {
      "entity_type": "VENDOR",
      "placeholder": "<VENDOR_1>",
      "allowed_ops": [],
      "allowed_he_ops": [],
      "policy_action": "tokenize_or_category",
      "source": "rule",
      "score": 0.97
    },
    "INVOICE_ID_1": {
      "entity_type": "INVOICE_ID",
      "placeholder": "<INVOICE_ID_1>",
      "allowed_ops": [],
      "allowed_he_ops": [],
      "policy_action": "tokenize_encrypt",
      "source": "rule",
      "score": 0.99
    },
    "PROJECT_CODE_1": {
      "entity_type": "PROJECT_CODE",
      "placeholder": "<PROJECT_CODE_1>",
      "allowed_ops": [],
      "allowed_he_ops": [],
      "policy_action": "tokenize_encrypt",
      "source": "rule",
      "score": 0.99
    },
    "COST_CENTER_1": {
      "entity_type": "COST_CENTER",
      "placeholder": "<COST_CENTER_1>",
      "allowed_ops": [],
      "allowed_he_ops": [],
      "policy_action": "tokenize_encrypt",
      "source": "rule",
      "score": 0.99
    },
    "EMPLOYEE_ID_1": {
      "entity_type": "EMPLOYEE_ID",
      "placeholder": "<EMPLOYEE_ID_1>",
      "allowed_ops": [],
      "allowed_he_ops": [],
      "policy_action": "tokenize_encrypt",
      "source": "rule",
      "score": 0.99
    },
    "EMAIL_1": {
      "entity_type": "EMAIL",
      "placeholder": "<EMAIL_1>",
      "allowed_ops": [],
      "allowed_he_ops": [],
      "policy_action": "tokenize_encrypt",
      "source": "rule",
      "score": 0.99
    },
    "PHONE_NUMBER_1": {
      "entity_type": "PHONE_NUMBER",
      "placeholder": "<PHONE_NUMBER_1>",
      "allowed_ops": [],
      "allowed_he_ops": [],
      "policy_action": "tokenize_encrypt",
      "source": "rule",
      "score": 0.99
    }
  },
  "policy_summary": {
    "meal_cap_usd": {
      "scope": "local_only",
      "description": "Meal expenses require local cap validation.",
      "supported_he_ops": [
        "fhe_subtract_policy_cap"
      ]
    },
    "hotel_cap_usd": {
      "scope": "local_only",
      "description": "Hotel expenses require local cap validation.",
      "supported_he_ops": [
        "fhe_subtract_policy_cap"
      ]
    },
    "airfare_cap_usd": {
      "scope": "local_only",
      "description": "Airfare expenses require local cap validation.",
      "supported_he_ops": [
        "fhe_subtract_policy_cap"
      ]
    },
    "taxi_cap_usd": {
      "scope": "local_only",
      "description": "Taxi and rideshare expenses require local cap validation.",
      "supported_he_ops": [
        "fhe_subtract_policy_cap"
      ]
    },
    "software_subscription_cap_usd": {
      "scope": "local_only",
      "description": "Software subscriptions require local cap validation.",
      "supported_he_ops": [
        "fhe_subtract_policy_cap"
      ]
    },
    "submission_window_days": {
      "scope": "local_only",
      "description": "Expense submission timing must be verified locally.",
      "supported_he_ops": [
        "fhe_compare_date_window"
      ]
    }
  },
  "public_context": {
    "workflow_type": "expense_review",
    "expense_type": "team_offsite",
    "currency": "USD",
    "policy_key": "meal_cap_usd",
    "receipt_attached": true,
    "requires_sum": true,
    "requires_cap_validation": true,
    "amount_handles_expected": 3
  }
}
